[
  {
    "id": "reading_001",
    "type": "open_ended",
    "question": "阅读短文，完成题目。\n\n下雨了，小路变得泥泞不堪，小明的鞋子上沾满了泥巴。他本来想回家换鞋，但想到今天要去看望生病的同学，他还是继续向前走去。\n\n请用一句话概括这段话的主要内容。",
    "options": [],
    "answer": "小明不怕困难，坚持去看望生病的同学",
    "analysis": "考点：概括段落主旨（排除表面信息干扰）\n\n解题思路：先找出事件核心，再判断作者重点强调的内容。文中既有“下雨泥泞”，也有“坚持前行”，要抓住行为背后的品质。\n\n总结：主旨题常设陷阱：用环境描写干扰你，必须抓“人物行为+态度”。",
    "knowledge_tag": "阅读理解",
    "ability_tag": "主旨概括",
    "difficulty": 2,
    "grade": 5
  },
  {
    "id": "reading_002",
    "type": "open_ended",
    "question": "阅读句子，完成题目。\n\n听到比赛失败的消息，他反而笑了，说：“这次让我看清了自己的不足。”\n\n句中“反而”的作用是什么？请简要说明。",
    "options": [],
    "answer": "表示出乎意料，说明他的反应与常人不同",
    "analysis": "考点：词语作用理解（转折关系）\n\n解题思路：先判断常规情况（失败应难过），再看实际表现（却笑了），分析词语作用。\n\n总结：词语作用题要看“预期”和“实际”是否相反。",
    "knowledge_tag": "阅读理解",
    "ability_tag": "词句理解",
    "difficulty": 2,
    "grade": 5
  },
  {
    "id": "reading_003",
    "type": "open_ended",
    "question": "阅读短文，完成题目。\n\n小华早上七点起床，吃完早饭后七点半出门，八点准时到校。放学后他先写作业，再去打篮球。\n\n问题：小华是几点出门的？",
    "options": [],
    "answer": "七点半",
    "analysis": "考点：信息提取（时间顺序）\n\n解题思路：按时间顺序逐条提取信息，注意不要被其他时间干扰。\n\n总结：细节题常用多个时间干扰，必须精准定位关键词。",
    "knowledge_tag": "阅读理解",
    "ability_tag": "信息提取",
    "difficulty": 2,
    "grade": 5
  },
  {
    "id": "reading_004",
    "type": "open_ended",
    "question": "阅读短文，完成题目。\n\n妈妈下班回家，看到桌子上已经摆好了热腾腾的饭菜，厨房也收拾得干干净净。她笑着说：“今天真轻松。”\n\n请推断：这些饭菜最有可能是谁做的？并说明理由。",
    "options": [],
    "answer": "最有可能是孩子做的，因为妈妈刚下班，而家里已经做好饭菜",
    "analysis": "考点：根据情境进行合理推断\n\n解题思路：结合人物身份和时间顺序进行判断，排除不合理可能。\n\n总结：推断题必须“有依据”，不能凭感觉。",
    "knowledge_tag": "阅读理解",
    "ability_tag": "推断想象",
    "difficulty": 3,
    "grade": 5
  },
  {
    "id": "reading_005",
    "type": "open_ended",
    "question": "阅读句子，完成题目。\n\n他默默地把地上的垃圾捡起来，什么也没说。\n\n这句话表现了人物什么品质？",
    "options": [],
    "answer": "表现了他默默做好事、不张扬的品质",
    "analysis": "考点：人物品质分析\n\n解题思路：从动作和语言入手，“默默”“什么也没说”是关键。\n\n总结：人物题一定抓“动作+态度词”。",
    "knowledge_tag": "阅读理解",
    "ability_tag": "词句理解",
    "difficulty": 2,
    "grade": 5
  },
  {
    "id": "reading_006",
    "type": "open_ended",
    "question": "阅读句子，完成题目。\n\n他说话声音不大，但每个人都听得很认真。\n\n这句话说明了什么？",
    "options": [],
    "answer": "说明他说的话很有吸引力或很有分量",
    "analysis": "考点：句意理解（对比关系）\n\n解题思路：抓“声音不大”和“认真听”的对比，分析原因。\n\n总结：出现“但”字，重点往往在后面。",
    "knowledge_tag": "阅读理解",
    "ability_tag": "词句理解",
    "difficulty": 3,
    "grade": 5
  },
  {
    "id": "reading_007",
    "type": "open_ended",
    "question": "阅读古诗，完成题目。\n\n“白日依山尽，黄河入海流。”\n\n请说明这两句诗描写的景象特点。",
    "options": [],
    "answer": "描写了夕阳西下、江河奔流的壮阔景象",
    "analysis": "考点：古诗画面理解\n\n解题思路：逐句分析意象：“白日”“山”“黄河”“海”。\n\n总结：古诗题必须“意象+整体画面”。",
    "knowledge_tag": "阅读理解",
    "ability_tag": "阅读理解",
    "difficulty": 3,
    "grade": 5
  },
  {
    "id": "reading_008",
    "type": "open_ended",
    "question": "阅读短文，完成题目。\n\n小刚平时成绩一般，但这次考试却取得了很好的成绩。他说：“我只是把该做的都认真做了一遍。”\n\n这段话主要说明了什么道理？",
    "options": [],
    "answer": "只要认真对待学习，就能取得进步",
    "analysis": "考点：归纳道理\n\n解题思路：从结果反推原因，抓住“认真”这一关键词。\n\n总结：道理题优先看人物“总结句”。",
    "knowledge_tag": "阅读理解",
    "ability_tag": "阅读理解",
    "difficulty": 2,
    "grade": 5
  },
  {
    "id": "reading_009",
    "type": "open_ended",
    "question": "阅读短文，完成题目。\n\n今天是星期三，小明要参加学校的足球比赛。比赛在下午三点开始，他中午一点就到学校做准备。\n\n问题：比赛几点开始？",
    "options": [],
    "answer": "下午三点",
    "analysis": "考点：关键信息提取\n\n解题思路：直接定位“比赛开始”相关信息。\n\n总结：题目问什么，就找什么，不要被时间干扰。",
    "knowledge_tag": "阅读理解",
    "ability_tag": "信息提取",
    "difficulty": 2,
    "grade": 5
  },
  {
    "id": "reading_010",
    "type": "open_ended",
    "question": "阅读短文，完成题目。\n\n小雨看到一只受伤的小鸟，她把小鸟带回家，细心照顾，直到小鸟康复后才把它放回大自然。\n\n请说说小雨是一个怎样的人，并说明理由。",
    "options": [],
    "answer": "小雨是一个善良、有爱心的人，因为她救助并照顾受伤的小鸟",
    "analysis": "考点：人物评价+理由表达\n\n解题思路：先总结品质，再用具体行为作为依据。\n\n总结：人物题标准答案结构：品质+具体行为。",
    "knowledge_tag": "阅读理解",
    "ability_tag": "阅读理解",
    "difficulty": 2,
    "grade": 5
  },
  {
    "id": "reading_011",
    "type": "open_ended",
    "question": "阅读短文时，我们常用“三读法”来帮助理解。请根据口诀补充完整。\n\n一读（　　），知大意；二读（　　），解词句；三读（　　），悟情理。",
    "options": [],
    "answer": "一读（浏览），知大意；二读（细读），解词句；三读（品读），悟情理。",
    "analysis": "考点：本题考查阅读方法的基本步骤和口诀记忆。\n\n解题思路：根据常见的阅读策略，第一遍快速读了解大意，第二遍仔细读理解词句，第三遍品味读感悟情感道理。\n\n总结：“三读法”是有效的阅读策略：浏览（粗读）→细读（精读）→品读（赏析）。平时阅读时养成习惯，能提高阅读理解能力。",
    "knowledge_tag": "阅读理解",
    "ability_tag": "阅读理解",
    "difficulty": 1,
    "grade": 5
  },
  {
    "id": "reading_012",
    "type": "single_choice",
    "question": "阅读下面短文，回答问题。\n\n《蜜蜂的赞美》\n人们赞美蜜蜂，尤其赞美它那种不辞辛苦、无私奉献的精神。它采一公斤蜜，需要在百万朵花上劳作，飞行距离相当于绕地球好几圈。蜜蜂酿蜜，不是为了自己，而是为了群体。它把最甜美的蜜献给了人类，自己却只吃很少一点。\n\n下列对短文内容理解正确的一项是（　）。",
    "options": [
      "A. 蜜蜂采一公斤蜜只需要飞行很短的距离。",
      "B. 蜜蜂酿蜜主要是为了自己享用。",
      "C. 人们赞美蜜蜂是因为它的勤劳和奉献精神。",
      "D. 蜜蜂采蜜不需要在花上劳作。"
    ],
    "answer": "C. 人们赞美蜜蜂是因为它的勤劳和奉献精神。",
    "analysis": "考点：本题考查对短文信息的提取和理解。\n\n解题思路：逐项与原文比对。\n\n总结：做阅读理解时，答案要在原文中找依据，不能凭主观想象。",
    "knowledge_tag": "阅读理解",
    "ability_tag": "阅读理解",
    "difficulty": 2,
    "grade": 5
  },
  {
    "id": "reading_013",
    "type": "open_ended",
    "question": "阅读下面文言文，回答问题。\n\n《狐假虎威》\n虎求百兽而食之，得狐。狐曰：“子无敢食我也！天帝使我长百兽，今子食我，是逆天帝命也。子以我为不信，吾为子先行，子随我后，观百兽之见我而敢不走乎？”虎以为然，故遂与之行。兽见之皆走。虎不知兽畏己而走也，以为畏狐也。\n\n（1）解释下列加点字的意思：\n①虎求百兽而食之（求：________）\n②天帝使我长百兽（长：________）\n③兽见之皆走（走：________）\n\n（2）这个故事告诉我们什么道理？\n________________________________________",
    "options": [],
    "answer": "（1）①求：寻找；②长：做首领，管理；③走：跑。\n（2）这个故事告诉我们：有的人倚仗别人的威势来欺压他人，其实自己并没有真本事。",
    "analysis": "考点：本题考查文言文字词解释和寓意理解。\n\n解题思路：结合上下文理解字义，根据故事整体把握寓意。\n\n总结：文言文中“走”古义是“跑”；“求”是“寻找”；“长”读zhǎng，动词。成语“狐假虎威”比喻倚仗别人的威势吓唬人。",
    "knowledge_tag": "阅读理解",
    "ability_tag": "词句理解",
    "difficulty": 2,
    "grade": 5
  },
  {
    "id": "reading_014",
    "type": "open_ended",
    "question": "阅读时概括段落大意，可以用“摘句法”和“合并法”。请补充口诀：\n\n摘句法：找（　　）句；\n合并法：几个意思（　　）一起。",
    "options": [],
    "answer": "摘句法：找（中心）句；合并法：几个意思（合并）一起。",
    "analysis": "考点：本题考查概括段落大意的方法。\n\n解题思路：摘句法就是直接摘取段落中的中心句；合并法就是把几个层次的意思合并起来。\n\n总结：概括段意的常用方法：摘句法（找中心句）、合并法（归纳各层意思）、串联法（串联关键词语）。",
    "knowledge_tag": "阅读理解",
    "ability_tag": "主旨概括",
    "difficulty": 2,
    "grade": 5
  },
  {
    "id": "reading_015",
    "type": "single_choice",
    "question": "阅读下面短文，回答问题。\n\n《时间就是生命》\n鲁迅先生非常珍惜时间。他说：“时间，就像海绵里的水，只要愿挤，总还是有的。”他一生多病，工作条件和生活环境都不好，但他每天都要工作到深夜。在逝世前不久，他还在病床上写文章。他曾经说过：“哪里有天才，我是把别人喝咖啡的工夫都用在工作上的。”\n\n下列对短文内容理解正确的一项是（　）。",
    "options": [
      "A. 鲁迅先生认为时间像海绵里的水，不需要珍惜。",
      "B. 鲁迅先生每天工作到深夜，是因为他身体很好。",
      "C. 鲁迅先生把别人喝咖啡的时间用在工作上，说明他珍惜时间。",
      "D. 鲁迅先生认为天才是天生的，不需要努力。"
    ],
    "answer": "C. 鲁迅先生把别人喝咖啡的时间用在工作上，说明他珍惜时间。",
    "analysis": "考点：本题考查对短文信息的理解和提取。\n\n解题思路：逐项与原文比对。\n\n总结：阅读时要抓住人物的言行和直接引语，这些往往是理解主旨的关键。",
    "knowledge_tag": "阅读理解",
    "ability_tag": "阅读理解",
    "difficulty": 2,
    "grade": 5
  },
  {
    "id": "reading_016",
    "type": "open_ended",
    "question": "阅读下面文言文，回答问题。\n\n《司马光》\n司马光幼时，与群儿戏于庭。一儿登瓮，足跌没水中，众皆弃去。光持石击瓮破之，水迸，儿得活。\n\n（1）文中“众皆弃去”中的“弃”意思是__________。\n（2）司马光用什么办法救出了落水儿童？\n________________________________________",
    "options": [],
    "answer": "（1）弃：抛弃、离开。\n（2）司马光拿起石头砸破水瓮，让水流出来，救出了落水儿童。",
    "analysis": "考点：本题考查文言文词语理解和事件概括。\n\n解题思路：结合上下文解释“弃”，概括司马光的做法。\n\n总结：这个故事体现了司马光沉着冷静、机智勇敢的品质。与“破瓮救友”是同一故事。",
    "knowledge_tag": "阅读理解",
    "ability_tag": "词句理解",
    "difficulty": 2,
    "grade": 5
  },
  {
    "id": "reading_017",
    "type": "open_ended",
    "question": "阅读中遇到不理解的词语，可以用以下方法。请补充口诀：\n\n（1）联系（　　）猜词义；\n（2）拆（　　）再组合；\n（3）找（　　）词来替换。",
    "options": [],
    "answer": "（1）联系（上下文）猜词义；\n（2）拆（字）再组合；\n（3）找（近义）词来替换。",
    "analysis": "考点：本题考查理解词语含义的方法。\n\n解题思路：常用方法：联系上下文、拆字法、近义词替换、联系生活实际等。\n\n总结：阅读时遇到生词不要慌，先上下文找线索，再拆字组合，或想想近义词，一般能猜出大概意思。",
    "knowledge_tag": "阅读理解",
    "ability_tag": "词句理解",
    "difficulty": 2,
    "grade": 5
  },
  {
    "id": "reading_018",
    "type": "single_choice",
    "question": "阅读下面短文，回答问题。\n\n《蚂蚁的团结》\n一只蚂蚁发现了一大块食物，但它搬不动。于是它回去叫来了同伴。几十只蚂蚁一起用力，终于把食物搬回了巢穴。蚂蚁虽然很小，但它们团结起来，就能战胜困难。\n\n下列对短文主旨概括最准确的一项是（　）。",
    "options": [
      "A. 蚂蚁很勤劳，每天都要搬食物。",
      "B. 蚂蚁搬食物需要很长时间。",
      "C. 团结就是力量，合作能战胜困难。",
      "D. 蚂蚁比人类更聪明。"
    ],
    "answer": "C. 团结就是力量，合作能战胜困难。",
    "analysis": "考点：本题考查概括短文主旨的能力。\n\n解题思路：找中心句：最后一句“团结起来，就能战胜困难”是主旨。\n\n总结：概括主旨要找文中的中心句或自己总结。常见主旨类型：说明道理、赞美品质、抒发感情等。",
    "knowledge_tag": "阅读理解",
    "ability_tag": "主旨概括",
    "difficulty": 1,
    "grade": 5
  },
  {
    "id": "reading_019",
    "type": "open_ended",
    "question": "阅读下面文言文，回答问题。\n\n《守株待兔》\n宋人有耕者。田中有株，兔走触株，折颈而死。因释其耒而守株，冀复得兔。兔不可复得，而身为宋国笑。\n\n（1）解释下列字的意思：\n①株（　）　②走（　）　③释（　）　④冀（　）\n\n（2）这个故事讽刺了什么样的人？\n________________________________________",
    "options": [],
    "answer": "（1）株：树桩；走：跑；释：放下；冀：希望。\n（2）讽刺了那些妄想不劳而获、死守狭隘经验、不知变通的人。",
    "analysis": "考点：本题考查文言文字词解释和寓意理解。\n\n解题思路：回忆成语故事，理解寓意。\n\n总结：“走”古义为“跑”；“冀”是“希望”。“守株待兔”比喻死守经验，不知变通，也想不劳而获。",
    "knowledge_tag": "阅读理解",
    "ability_tag": "词句理解",
    "difficulty": 3,
    "grade": 5
  },
  {
    "id": "reading_020",
    "type": "open_ended",
    "question": "阅读时划分段落层次，可以按时间、空间、事情发展等顺序。请补充口诀：\n\n按时间：找（　　）词；\n按空间：找（　　）词；\n按事情发展：找（　　）→经过→（　　）。",
    "options": [],
    "answer": "按时间：找（时间）词；\n按空间：找（方位）词；\n按事情发展：找（起因）→经过→（结果）。",
    "analysis": "考点：本题考查划分段落层次的方法。\n\n解题思路：按时间顺序找“早上、中午、晚上”等；按空间顺序找“东、西、南、北、里、外”等；按事情发展找起因、经过、结果。\n\n总结：划分段落层次是阅读理解的基础，要根据文章的写作顺序来分段。",
    "knowledge_tag": "阅读理解",
    "ability_tag": "阅读理解",
    "difficulty": 2,
    "grade": 5
  },
  {
    "id": "reading_021",
    "type": "open_ended",
    "question": "阅读说明文时，我们常用“三看”法。请补充口诀：\n\n一看（　　），明对象；\n二看（　　），理顺序；\n三看（　　），抓方法。",
    "options": [],
    "answer": "一看（标题），明对象；二看（结构），理顺序；三看（语言），抓方法。",
    "analysis": "考点：本题考查说明文的阅读方法。\n\n解题思路：说明文阅读要关注标题（明确说明对象）、文章结构（时间、空间、逻辑顺序）、语言特点（准确性、科学性、说明方法）。\n\n总结：阅读说明文，先看标题知道写什么，再看段落结构了解写作顺序，最后分析说明方法（举例子、列数字、打比方等）。",
    "knowledge_tag": "阅读理解",
    "ability_tag": "阅读理解",
    "difficulty": 2,
    "grade": 5
  },
  {
    "id": "reading_022",
    "type": "open_ended",
    "question": "阅读下面文言文，回答问题。\n\n《孔融让梨》\n孔融四岁，与诸兄食梨，辄取小者。人问其故，答曰：“我小儿，法当取小者。”\n\n（1）解释下列字的意思：\n①辄（　）　②故（　）　③法（　）\n\n（2）孔融为什么拿小的梨？这体现了他怎样的品质？\n________________________________________",
    "options": [],